{
  "schema_version": "0.6.0",
  "export_id": "exp_0123456789abcdef",
  "generated_at": "2026-08-12T18:01:00Z",
  "account": {
    "user_id": "usr_0123456789abcdef",
    "status": "active",
    "locale": "en-US",
    "timezone": "America/Chicago",
    "entitlement_tier": "free",
    "created_at": "2026-08-01T00:00:00Z"
  },
  "birth_profiles": [],
  "chart_snapshots": [],
  "preferences": {
    "locale": "en-US",
    "locale_source": "user_confirmed",
    "timezone": "America/Chicago",
    "timezone_source": "user_confirmed",
    "timezone_revision": 1,
    "entitlement_tier": "free",
    "next_due_at": null
  },
  "timezone_changes": [],
  "consents": [],
  "context_sources": [],
  "context_signals": [],
  "readings": {
    "status": "included",
    "items": []
  },
  "journal": {
    "status": "not_available",
    "items": []
  }
}
